{"acceptance_state_hash":"32ed03a76d0ab0e8142330524646b36f2e3fb6c1fe936ec842845c2f98a86ff8","artifacts":[{"role":"esp_loader","sha256":"f6b3a49fda984da3107eded83e4fbb9bedd2159aa1094a3eb79534f0cbc5466e","size_bytes":26},{"role":"installer_uki","sha256":"49dec361b29af35bd4e6a89b96dab88c2097fb71593573b13f8a3b4b20022235","size_bytes":29},{"role":"offline_system_image","sha256":"b964eb0d7eb0933041a13132501c338c0c260958f2c553c40c3abf3c4795d998","size_bytes":36},{"role":"recovery_uki","sha256":"b93a6b45e48823ec27f77bc744c5cafb615c0d7b358288369a0cbdc131034401","size_bytes":28}],"manifest_digest":"c3f4abaf3ffffa45085e1e9404743b840c931360821ff5161149af4b74338669","schema_version":1}
